{
  "meta": {
    "name": "Starlight Knowledge Tree",
    "version": "0.2.0",
    "license": {
      "data": "CC-BY-4.0",
      "code": "MIT"
    },
    "attestation": "Built on SIP — Starlight Intelligence Protocol",
    "substrate": "starlightintelligence.org/protocol",
    "ontology": "verticals/knowledge-tree/ONTOLOGY.md",
    "domainPrefixes": {
      "math": "mathematics",
      "phys": "physics-cosmos",
      "life": "life-mind",
      "comp": "computation-intelligence",
      "energy": "energy-matter",
      "ai": "ai-architect",
      "space": "space-builder",
      "bio": "bio-intelligence",
      "creator": "creator-founder"
    },
    "changelog": [
      "0.1.0 — 2026-06 — seed path graph (4 domains, 44 nodes, 48 edges) authored in site bundle",
      "0.2.0 — 2026-07-17 — canon layer: +5 foundation domains, foundation trunk nodes/edges, provenance + confidence fields, cross-domain bridges"
    ],
    "counts": {
      "domains": 9,
      "nodes": 95,
      "edges": 101
    }
  },
  "domains": [
    {
      "id": "mathematics",
      "name": "Mathematics",
      "accent": "violet",
      "tier": "foundation",
      "blurb": "The language of structure, quantity, and proof — the trunk everything else grows from."
    },
    {
      "id": "physics-cosmos",
      "name": "Physics & Cosmos",
      "accent": "cyan",
      "tier": "foundation",
      "blurb": "Matter, energy, spacetime, and the universe at every scale."
    },
    {
      "id": "life-mind",
      "name": "Life & Mind",
      "accent": "emerald",
      "tier": "foundation",
      "blurb": "The living substrate — from molecules to cells to cognition."
    },
    {
      "id": "computation-intelligence",
      "name": "Computation & Intelligence",
      "accent": "amber",
      "tier": "foundation",
      "blurb": "What can be computed, how, and how intelligence arises in matter."
    },
    {
      "id": "energy-matter",
      "name": "Energy & Matter",
      "accent": "rose",
      "tier": "foundation",
      "blurb": "The chemistry and energetics that build and power everything physical."
    },
    {
      "id": "ai-architect",
      "name": "AI Architect",
      "accent": "cyan",
      "blurb": "Design intelligence systems that compose without losing control.",
      "tier": "path"
    },
    {
      "id": "space-builder",
      "name": "Space Builder",
      "accent": "amber",
      "blurb": "Move mass, energy, and information off the surface of a planet.",
      "tier": "path"
    },
    {
      "id": "bio-intelligence",
      "name": "Bio / Human Intelligence",
      "accent": "emerald",
      "blurb": "Understand and extend the living, thinking substrate.",
      "tier": "path"
    },
    {
      "id": "creator-founder",
      "name": "Creator-Founder",
      "accent": "fuchsia",
      "blurb": "Turn taste and systems into products people pay for.",
      "tier": "path"
    }
  ],
  "nodes": [
    {
      "id": "math/concept/set-theory",
      "label": "Set Theory",
      "kind": "concept",
      "domainId": "mathematics",
      "summary": "ZFC axioms — the foundational language in which modern mathematics is formalized.",
      "confidence": "established",
      "refs": [
        {
          "type": "wikidata",
          "id": "Q12482"
        },
        {
          "type": "isbn",
          "id": "978-1-4419-8556-8",
          "note": "Jech, Set Theory"
        }
      ],
      "difficulty": 3
    },
    {
      "id": "math/concept/logic-proof",
      "label": "Logic & Proof",
      "kind": "concept",
      "domainId": "mathematics",
      "summary": "Formal deduction: what it means for a statement to follow from axioms.",
      "confidence": "established",
      "refs": [
        {
          "type": "wikidata",
          "id": "Q8078"
        }
      ],
      "difficulty": 2
    },
    {
      "id": "math/concept/number-theory",
      "label": "Number Theory",
      "kind": "concept",
      "domainId": "mathematics",
      "summary": "The deep structure of the integers — primes, divisibility, Diophantine equations.",
      "confidence": "established",
      "refs": [
        {
          "type": "wikidata",
          "id": "Q12479"
        }
      ],
      "difficulty": 3
    },
    {
      "id": "math/concept/linear-algebra",
      "label": "Linear Algebra",
      "kind": "concept",
      "domainId": "mathematics",
      "summary": "Vector spaces and linear maps — the computational backbone of science and ML.",
      "confidence": "established",
      "refs": [
        {
          "type": "wikidata",
          "id": "Q82571"
        }
      ],
      "difficulty": 2
    },
    {
      "id": "math/concept/calculus-analysis",
      "label": "Calculus & Analysis",
      "kind": "concept",
      "domainId": "mathematics",
      "summary": "Limits, derivatives, integrals — the mathematics of continuous change.",
      "confidence": "established",
      "refs": [
        {
          "type": "wikidata",
          "id": "Q149972"
        }
      ],
      "difficulty": 2
    },
    {
      "id": "math/concept/probability",
      "label": "Probability Theory",
      "kind": "concept",
      "domainId": "mathematics",
      "summary": "Kolmogorov's axioms — rigorous reasoning under uncertainty.",
      "confidence": "established",
      "refs": [
        {
          "type": "wikidata",
          "id": "Q5862903"
        }
      ],
      "difficulty": 3
    },
    {
      "id": "math/concept/group-theory",
      "label": "Group Theory",
      "kind": "concept",
      "domainId": "mathematics",
      "summary": "The mathematics of symmetry — foundational to physics and cryptography.",
      "confidence": "established",
      "refs": [
        {
          "type": "wikidata",
          "id": "Q874429"
        }
      ],
      "difficulty": 3
    },
    {
      "id": "math/concept/topology",
      "label": "Topology",
      "kind": "concept",
      "domainId": "mathematics",
      "summary": "Properties preserved under continuous deformation — shape without distance.",
      "confidence": "established",
      "refs": [
        {
          "type": "wikidata",
          "id": "Q42989"
        }
      ],
      "difficulty": 4
    },
    {
      "id": "math/evidence/godel-incompleteness",
      "label": "Gödel's Incompleteness Theorems",
      "kind": "evidence",
      "domainId": "mathematics",
      "summary": "Any consistent formal system rich enough for arithmetic contains true statements it cannot prove.",
      "confidence": "established",
      "refs": [
        {
          "type": "wikidata",
          "id": "Q200787"
        },
        {
          "type": "doi",
          "id": "10.1007/BF01700692"
        }
      ],
      "last_verified": "2026-07-17"
    },
    {
      "id": "math/quest/riemann-hypothesis",
      "label": "Riemann Hypothesis",
      "kind": "quest",
      "domainId": "mathematics",
      "summary": "Do all non-trivial zeros of the Riemann zeta function lie on the critical line Re(s)=1/2? Success: a proof or disproof. Unsolved since 1859; a Clay Millennium Problem.",
      "confidence": "contested",
      "refs": [
        {
          "type": "wikidata",
          "id": "Q192129"
        },
        {
          "type": "url",
          "id": "https://www.claymath.org/millennium/riemann-hypothesis/"
        }
      ],
      "difficulty": 5
    },
    {
      "id": "math/quest/p-vs-np",
      "label": "P versus NP",
      "kind": "quest",
      "domainId": "mathematics",
      "summary": "Can every problem whose solution is quickly verifiable also be quickly solved? Success: proof that P=NP or P≠NP. A Clay Millennium Problem; foundational to computation and cryptography.",
      "confidence": "contested",
      "refs": [
        {
          "type": "wikidata",
          "id": "Q746242"
        },
        {
          "type": "url",
          "id": "https://www.claymath.org/millennium/p-vs-np/"
        }
      ],
      "difficulty": 5
    },
    {
      "id": "phys/concept/classical-mechanics",
      "label": "Classical Mechanics",
      "kind": "concept",
      "domainId": "physics-cosmos",
      "summary": "Newtonian and Lagrangian dynamics — motion of matter under forces.",
      "confidence": "established",
      "refs": [
        {
          "type": "wikidata",
          "id": "Q11397"
        }
      ],
      "difficulty": 2
    },
    {
      "id": "phys/concept/thermodynamics",
      "label": "Thermodynamics",
      "kind": "concept",
      "domainId": "physics-cosmos",
      "summary": "Energy, entropy, and the arrow of time — the laws heat and work obey.",
      "confidence": "established",
      "refs": [
        {
          "type": "wikidata",
          "id": "Q11473"
        }
      ],
      "difficulty": 3
    },
    {
      "id": "phys/concept/electromagnetism",
      "label": "Electromagnetism",
      "kind": "concept",
      "domainId": "physics-cosmos",
      "summary": "Maxwell's unification of electricity, magnetism, and light.",
      "confidence": "established",
      "refs": [
        {
          "type": "wikidata",
          "id": "Q11406"
        }
      ],
      "difficulty": 3
    },
    {
      "id": "phys/concept/special-relativity",
      "label": "Special Relativity",
      "kind": "concept",
      "domainId": "physics-cosmos",
      "summary": "Spacetime, the constancy of light speed, mass-energy equivalence.",
      "confidence": "established",
      "refs": [
        {
          "type": "wikidata",
          "id": "Q11455"
        }
      ],
      "difficulty": 3
    },
    {
      "id": "phys/concept/general-relativity",
      "label": "General Relativity",
      "kind": "concept",
      "domainId": "physics-cosmos",
      "summary": "Gravity as the curvature of spacetime by mass-energy.",
      "confidence": "established",
      "refs": [
        {
          "type": "wikidata",
          "id": "Q11452"
        },
        {
          "type": "doi",
          "id": "10.1002/andp.19163540702"